<?xml version="1.0" encoding="UTF-8"?>
<?xml-stylesheet type="text/xsl" href="feature-map.xsl"?>
<featureMap xmlns:xsi="http://www.w3.org/2001/XMLSchema-instance"
            xsi:noNamespaceSchemaLocation="feature-map.xsd"
            version="1.3"
            mode="change"
            state="investigating">
  <meta>
    <system>Sample System</system>
    <feature>Center Receiving</feature>
  </meta>
  <goal>
    <purpose>センター入庫処理を他工場在庫にも対応させる。</purpose>
    <done>対象ケースを実装し、代表ケースと回帰ケースで検証できる。</done>
    <scope>入庫判定と在庫取得。</scope>
    <exclude>後続SAP送信処理と共通テーブルの構造変更。</exclude>
  </goal>
  <useCase id="UC1">
    <scenario>入庫データ受信時、対象工場の在庫を確認して入庫可否を判定する。</scenario>
    <sample>工場A・他工場在庫ありの既存データ1件</sample>
  </useCase>
  <sourceMap>
    <ref id="S1" kind="entry" target="ReceivingService.Import"/>
    <ref id="S2" kind="symbol" target="InventoryService.GetStock"/>
    <ref id="S3" kind="procedure" target="PKG_RECEIVING.IMPORT" access="execute"/>
    <ref id="S4" kind="table" target="STOCK" access="read"/>
    <ref id="S5" kind="test" target="ReceivingImportTests"/>
  </sourceMap>
  <diagrams>
    <diagram id="DG1" kind="sequence" title="入庫判定シーケンス"><![CDATA[
sequenceDiagram
    actor User as 担当者
    participant API as ReceivingService
    participant Stock as InventoryService
    participant DB as STOCK
    User->>API: 入庫データを送信
    API->>Stock: 対象工場の在庫を取得
    Stock->>DB: 在庫を参照
    DB-->>Stock: 在庫情報
    Stock-->>API: 判定用在庫
    API-->>User: 入庫結果
    ]]></diagram>
    <diagram id="DG2" kind="class" title="主要クラス関係"><![CDATA[
classDiagram
    class ReceivingService {
      +Import(receivingData)
    }
    class InventoryService {
      +GetStock(factoryCode, itemCode)
    }
    ReceivingService --> InventoryService : uses
    ]]></diagram>
  </diagrams>
  <knowledge>
    <rule id="R1">在庫判定は対象工場単位で行う。</rule>
    <invariant id="I1">SAP連携済データを再送しない。</invariant>
    <decision id="D1" reason="既存I/Fへの影響を限定する">在庫取得範囲だけを拡張する。</decision>
  </knowledge>
  <verify>
    <case id="V1" type="normal" status="planned">
      <condition>他工場在庫あり</condition>
      <expect>入庫可能として処理される</expect>
    </case>
    <case id="V2" type="regression" status="planned">
      <condition>従来工場の既存正常データ</condition>
      <expect>既存結果と一致する</expect>
    </case>
  </verify>
  <open>
    <item id="O1" type="expected-behavior" impact="medium" next="実データで分岐を確認する">工場コード未設定時の既存挙動</item>
  </open>
</featureMap>
